id,name,price,description1,description2,imageurl
0,Ergonomic Plastic Cheese,838.00,Consequatur pariatur voluptate qui cum beatae ducimus unde beatae dolor.,Dolores id ut quis odit quis aut sequi eos.,https://unsplash.it/500/300?image=17,https://unsplash.it/500/300?image=730,https://unsplash.it/500/300?image=247,https://unsplash.it/500/300?image=791,https://unsplash.it/500/300?image=13
1,Awesome Rubber Chicken,341.00,Asperiores quod fugit recusandae quam quos itaque molestiae quos optio.,Ad impedit consequatur et.,https://unsplash.it/500/300?image=831,https://unsplash.it/500/300?image=221,https://unsplash.it/500/300?image=110,https://unsplash.it/500/300?image=293,https://unsplash.it/500/300?image=701
2,Refined Metal Chicken,255.00,Vitae quos tempore ut reiciendis exercitationem quia.,Libero et asperiores officia quia quia qui.,https://unsplash.it/500/300?image=631,https://unsplash.it/500/300?image=334,https://unsplash.it/500/300?image=360,https://unsplash.it/500/300?image=899,https://unsplash.it/500/300?image=736
3,Licensed Rubber Cheese,928.00,Porro quidem dolorum illum.,Quisquam facilis delectus et.,https://unsplash.it/500/300?image=996,https://unsplash.it/500/300?image=638,https://unsplash.it/500/300?image=524,https://unsplash.it/500/300?image=643,https://unsplash.it/500/300?image=292
4,Handcrafted Rubber Shirt,785.00,Fugiat aut eos ullam qui omnis itaque veniam est molestiae.,Inventore culpa qui nisi et animi ut praesentium quae.,https://unsplash.it/500/300?image=830,https://unsplash.it/500/300?image=715,https://unsplash.it/500/300?image=894,https://unsplash.it/500/300?image=866,https://unsplash.it/500/300?image=629
5,Unbranded Cotton Cheese,23.00,Quia saepe architecto nihil sint est debitis.,Non temporibus occaecati voluptates id repellat laborum et.,https://unsplash.it/500/300?image=899,https://unsplash.it/500/300?image=981,https://unsplash.it/500/300?image=561,https://unsplash.it/500/300?image=475,https://unsplash.it/500/300?image=559
6,Fantastic Metal Chips,205.00,Ducimus excepturi ipsam aut quis aperiam itaque.,Facilis nisi et aut iste qui iusto repellendus ut.,https://unsplash.it/500/300?image=781,https://unsplash.it/500/300?image=836,https://unsplash.it/500/300?image=538,https://unsplash.it/500/300?image=738,https://unsplash.it/500/300?image=672
7,Incredible Cotton Car,580.00,Laudantium eum nobis nisi quo et.,In nostrum rerum velit aut nobis amet aliquid quisquam et.,https://unsplash.it/500/300?image=934,https://unsplash.it/500/300?image=728,https://unsplash.it/500/300?image=932,https://unsplash.it/500/300?image=992,https://unsplash.it/500/300?image=202
8,Gorgeous Frozen Mouse,61.00,Corrupti autem animi consequatur quos.,Laboriosam quis aut sint animi odio.,https://unsplash.it/500/300?image=672,https://unsplash.it/500/300?image=263,https://unsplash.it/500/300?image=87,https://unsplash.it/500/300?image=549,https://unsplash.it/500/300?image=165
9,Rustic Rubber Ball,368.00,Facilis pariatur voluptatem cupiditate illo.,Ratione inventore eum quis.,https://unsplash.it/500/300?image=993,https://unsplash.it/500/300?image=935,https://unsplash.it/500/300?image=68,https://unsplash.it/500/300?image=709,https://unsplash.it/500/300?image=135